<?xml version="1.0" encoding="UTF-8"?>
<logs xmlns="http://www.uts.edu.au/31284/log"
	xmlns:xsi="http://www.w3.org/2001/XMLSchema-instance"
	xsi:schemaLocation="http://www.uts.edu.au/31284/log xsd/log.xsd">
	
	<log>
		<id>1</id>
		<driver>hel@hello.com</driver> 
		<startdate>2012-09-24</startdate>
		<enddate>2015-11-11</enddate>
		<starttime>09:00:11</starttime>
		<endtime>23:11:24</endtime>
		<description>My first drive</description>
		<kilometres>232123</kilometres>
		<hidden value="true">f33i@iod.com</hidden>
	</log>
	
	<log>
		<id>1</id>
		<driver>1@bla.com</driver>
		<startdate>2012-09-24</startdate>
		<enddate>2015-11-11</enddate>
		<starttime>09:00:11</starttime>
		<endtime>23:11:24</endtime>
		<description>My first drive</description>
		<kilometres>232123</kilometres>
		<hidden value="false">2222@sdoif.com</hidden>
	</log>
	
	<log>
		<id>1</id>
		<driver>hesiofah@asdf.com</driver>
		<startdate>2012-09-24</startdate>
		<enddate>2015-11-11</enddate>
		<starttime>09:00:11</starttime>
		<endtime>23:11:24</endtime>
		<description>My first drive</description>
		<kilometres>232123</kilometres>
		<hidden value="true">1sdio@bla.com</hidden>
	</log>
	
</logs>
